{
  "document_title": "MongoDB 4.2.6 - Jepsen Report",
  "source_pdf": "mongodb-4.2.6.pdf",
  "url": "local://mongodb-4.2.6.pdf",
  "tags": [
    "distributed-systems",
    "incident-report",
    "jepsen",
    "consistency",
    "mongodb",
    "snapshot-isolation",
    "transactions"
  ],
  "book": {
    "title": "MongoDB 4.2.6",
    "edition": "First Edition",
    "version": "4.2.6",
    "author": "Kyle Kingsbury",
    "date": "2020-05-15"
  }
}
